### ISSUE TITLE
「Comment」https://icyfenix.cn/immutable-infrastructure/network/linux-vnet.html

### ISSUE THREAD

**Issue by fenixsoft** [fenixsoft/awesome-fenix#225]
https://icyfenix.cn/immutable-infrastructure/network/linux-vnet.html

**Comment by UUNNFLY** [comment]
VXLAN中MAC地址是出现两次吗？一次是最外层的Outer MAC Header，一次是里面的原始数据链路帧。这两个MAC地址是一样的吗

**Comment by fenixsoft** [comment]
> @UUNNFLY
> VXLAN中MAC地址是出现两次吗？一次是最外层的Outer MAC Header，一次是里面的原始数据链路帧。这两个MAC地址是一样的吗

绝大部分情况都不一样呀，MAC的地址的作用是供二层交换机确定下一条（Next Hop）的机器位置，每经过一次网络跳点就会改变一次的。

**Comment by bigbenfather** [comment]
“但两个加起来就可以存储224=16,777,216个不同的VLAN ID了”中224应该是$2^24$

**Comment by 563809169** [comment]
> 可见，经过主机协议栈后，数据包的源和目标 IP 地址均为公网的 IP，这个数据包在外部网络中可以根据 IP 正确路由到目标服务器手上。当目标服务器处理完毕，对该请求发出响应后，返回数据包的目标地址也是公网 IP。当返回的数据包经过链路所有跳点，由 eth0 达到网桥时，报文头中的地址为：

源 MAC：eth0 的 MAC
目标 MAC：网桥的 MAC
源 IP：外网的 IP，即 122.246.6.183
目标 IP：eth0 的 IP，即 14.123.254.86

**Comment by fenixsoft** [comment]
> @563809169
> @fenixsoft 请教一下
> > 可见，经过主机协议栈后，数据包的源和目标 IP 地址均为公网的 IP，这个数据包在外部网络中可以根据 IP 正确路由到目标服务器手上。当目标服务器处理完毕，对该请求发出响应后，返回数据包的目标地址也是公网 IP。当返回的数据包经过链路所有跳点，由 eth0 达到网桥时，报文头中的地址为：
> 
> >源 MAC：eth0 的 MAC
> >目标 MAC：网桥的 MAC
> >源 IP：外网的 IP，即 122.246.6.183
> >目标 IP：eth0 的 IP，即 14.123.254.86
> 
> 当到达eth0的时候, 报文头应该是
> 源 MAC：上一跳MAC
> 目标 MAC：eth0的MAC
> 源 IP：外网的 IP，即 122.246.6.183
> 目标 IP：eth0 的 IP，即 14.123.254.86
> 这样的吧, 那么到达网桥的时候为什么源MAC变成了eth0 的 MAC, 目标MAC是网桥的MAC呢?

到达eth0的包是你写的这个没错。之后包还要经过一次从eth0->br0这次转发，此时eth0 device将源mac改成自己的，目标mac改成br0的。

**Comment by 563809169** [comment]
> @fenixsoft
> > @563809169
> > @fenixsoft 请教一下
> > > 可见，经过主机协议栈后，数据包的源和目标 IP 地址均为公网的 IP，这个数据包在外部网络中可以根据 IP 正确路由到目标服务器手上。当目标服务器处理完毕，对该请求发出响应后，返回数据包的目标地址也是公网 IP。当返回的数据包经过链路所有跳点，由 eth0 达到网桥时，报文头中的地址为：
> > 
> > >源 MAC：eth0 的 MAC
> > >目标 MAC：网桥的 MAC
> > >源 IP：外网的 IP，即 122.246.6.183
> > >目标 IP：eth0 的 IP，即 14.123.254.86
> > 
> > 当到达eth0的时候, 报文头应该是
> > 源 MAC：上一跳MAC
> > 目标 MAC：eth0的MAC
> > 源 IP：外网的 IP，即 122.246.6.183
> > 目标 IP：eth0 的 IP，即 14.123.254.86
> > 这样的吧, 那么到达网桥的时候为什么源MAC变成了eth0 的 MAC, 目标MAC是网桥的MAC呢?
> 
> 到达eth0的包是你写的这个没错。之后包还要经过一次从eth0->br0这次转发，此时eth0 device将源mac改成自己的，目标mac改成br0的。

原文的veth0的ip应该是192.168.1.10吧, 也就是第一步产生的数据包的源ip和最后一步的目标ip。

按照文中的逻辑没有走通, 我重新梳理了一遍流程, 麻烦周大神解惑😊 , 看看哪里想的不对

发送数据包
1. 首先ns1中的数据包根据路由规则 需要转发给网桥。
2. 网桥收到数据之后, 由于目标MAC地址是网桥的地址, 所以交给了主机的协议栈。
3. 主机协议栈判断不是发给当前主机的数据包, 并且允许ip forward, 所以就会根据路由规则找下一跳地址, 也就是主机配置的网关, 然后做SNAT (veth0 ip -> eth0 ip), 然后发给eth0 (这一步没有网桥参与)。
4. eth0转发数据包, 这样数据包就发出去了。

接收数据包
1. eth0接收到数据包, 向上交给协议栈, 做DNAT(eth0 ip -> veth0 ip)。
2. 主机协议栈判断不是发给当前主机的数据包, 并且允许ip forward, 所以就会根据路由规则找下一跳地址, (由于配置了网桥, 所以会增加一条到192.168.x.0这个网段的路由) 目标MAC是网桥MAC, 源MAC就是eth0 MAC, 相当于一台主机里面有2个路由器? 
3. 接着这个网桥就相当于路由器了 找到veth0 ip的MAC, 然后封装二层包, 从veth1出去, 从ns1的veth0进来。

上面接收数据包的流程和文章介绍的就不太一样了, 如果我按照文章的思路走是
1. eth0接收到数据包, 然后需要转发到网桥, 这里的转发过程由于替换了MAC地址,按道理应该是三层转发, 那么这层转发是怎么做到的呢, 因为文中提到DNAT是下一步, 如果是主机协议栈处理的, ip是当前eth0的, MAC也是当前主机的, 那应该当前主机接收数据包!
2. 文中提到, 发给网桥的数据包目标MAC是网桥的MAC地址, 所以交给了主机的协议栈, 在这一步进行了DNAT(eth0 ip -> veth0 ip),(如果第一步成立, 为什么不是在第一步? 按道理第一步也会走iptables的规则吧) 。
3. 如果1-2步成立, 发给主机协议栈的数据又发回给网桥 目标MAC地址变成了ns1中veth0的MAC地址, 从veth1出去被veth0接收。

**Comment by yjp211** [comment]
> @fenixsoft
> > @563809169
> > @fenixsoft 请教一下
> > > 可见，经过主机协议栈后，数据包的源和目标 IP 地址均为公网的 IP，这个数据包在外部网络中可以根据 IP 正确路由到目标服务器手上。当目标服务器处理完毕，对该请求发出响应后，返回数据包的目标地址也是公网 IP。当返回的数据包经过链路所有跳点，由 eth0 达到网桥时，报文头中的地址为：
> > 
> > >源 MAC：eth0 的 MAC
> > >目标 MAC：网桥的 MAC
> > >源 IP：外网的 IP，即 122.246.6.183
> > >目标 IP：eth0 的 IP，即 14.123.254.86
> > 
> > 当到达eth0的时候, 报文头应该是
> > 源 MAC：上一跳MAC
> > 目标 MAC：eth0的MAC
> > 源 IP：外网的 IP，即 122.246.6.183
> > 目标 IP：eth0 的 IP，即 14.123.254.86
> > 这样的吧, 那么到达网桥的时候为什么源MAC变成了eth0 的 MAC, 目标MAC是网桥的MAC呢?
> 
> 到达eth0的包是你写的这个没错。之后包还要经过一次从eth0->br0这次转发，此时eth0 device将源mac改成自己的，目标mac改成br0的。

请教下eth0->br0这次转发的依据是什么（为什么要转发给br0）?

**Comment by kursk-ye** [comment]
"它自己也无可分割地连接着一台有着完整网络协议栈的 Linux 主机"

应该是

""它自己也无可避免地连接着一台有着完整网络协议栈的 Linux 主机

**Comment by AnyUncle** [comment]
“所有这种网络模式实际很少使用”应该改为“所以这种网络模式实际很少使用”吧。

**Comment by silkyall** [comment]
原文：”通过程序编码才够能使用“，修改为“才能够使用”会通顺些

**Comment by fenixsoft** [comment]
> 原文：”通过程序编码才够能使用“，修改为“才能够使用”会通顺些

> “所有这种网络模式实际很少使用”应该改为“所以这种网络模式实际很少使用”吧。

已更正，谢谢。

**Comment by SBZORRO** [comment]
图12-5下的步骤1：“ 源 IP：veth0 的 IP，即 192.168.31.1” 是不是不对？31.1不是网桥的IP么？

**Comment by oranges0908** [comment]
周老师
1. 应用程序调用 Socket API 发送数据，此时生成的原始数据包为：

源 MAC：veth0 的 MAC
目标 MAC：网关的 MAC（即网桥的 MAC）
源 IP：veth0 的 IP，即 192.168.31.1
目标 IP：外网的 IP，即 122.246.6.183

“源 IP：veth0 的 IP” 不应该三个容器中的 veth0 网卡分配 IP 地址：192.168.1.10、192.168.1.11、192.168.1.12中的一个吗

**Comment by ssingularity** [comment]
> @yjp211
> > @fenixsoft
> > > @563809169
> > > @fenixsoft 请教一下
> > > > 可见，经过主机协议栈后，数据包的源和目标 IP 地址均为公网的 IP，这个数据包在外部网络中可以根据 IP 正确路由到目标服务器手上。当目标服务器处理完毕，对该请求发出响应后，返回数据包的目标地址也是公网 IP。当返回的数据包经过链路所有跳点，由 eth0 达到网桥时，报文头中的地址为：
> > > 
> > > >源 MAC：eth0 的 MAC
> > > >目标 MAC：网桥的 MAC
> > > >源 IP：外网的 IP，即 122.246.6.183
> > > >目标 IP：eth0 的 IP，即 14.123.254.86
> > > 
> > > 当到达eth0的时候, 报文头应该是
> > > 源 MAC：上一跳MAC
> > > 目标 MAC：eth0的MAC
> > > 源 IP：外网的 IP，即 122.246.6.183
> > > 目标 IP：eth0 的 IP，即 14.123.254.86
> > > 这样的吧, 那么到达网桥的时候为什么源MAC变成了eth0 的 MAC, 目标MAC是网桥的MAC呢?
> > 
> > 到达eth0的包是你写的这个没错。之后包还要经过一次从eth0->br0这次转发，此时eth0 device将源mac改成自己的，目标mac改成br0的。
> 
> 请教下eth0->br0这次转发的依据是什么（为什么要转发给br0）?

@yjp211 @fenixsoft 这里我是这么理解的，数据包首先回到了eth0，此时目标IP是eth0的IP，然后进入了协议栈并进入IP层的处理，此时因为之前的SNAT的记录，会触发在PRE_ROUTINT的钩子将target_ip转为veth0的ip，然后进入IP层中的路由阶段，因为网桥本身配置了对应veth0所在网段的IP，因此会生成一条对应的直连路由，因此路由选择会挑选网桥作为数据包的出口，此时目标MAC地址就成为了网桥的MAC地址，从而数据包进入了网桥，所以这里是不是周老师写错了，在数据包到达网桥时，目标IP应该是veth0的IP？

同时这里我也有一个疑问，就是按照周老师说的**如果数据包的目的 MAC 地址为网桥本身，并且网桥有设置了 IP 地址的话，那该数据包即被认为是收到发往创建网桥那台主机的数据包，此数据包将不会转发到任何设备，而是直接交给上层（三层）协议栈去处理。**，此时数据包到达网桥本身符合了这条规则，那么数据包不应该会转发而是交给上层协议栈呀，这时候岂不是就到不了veth0了，所以这里是不是既会转发又交给上层协议栈处理？

另外在这篇[公众号博文](https://mp.weixin.qq.com/s/Arcz3RWe_o0Ijw6uPWKdVw)下也有类似的讲解，而我也在自己的Docker容器中做了一下实验，往外网的10.0.0.100发送了ICMP包，然后分别在Docker0和物理网卡上抓了一下包，可以看出当包达到虚拟网桥的时候目标IP已经发生了修改：
```
root@ist-PowerEdge-R720:~# tcpdump -i docker0 icmp
00:08:52.772712 IP 172.17.0.2 > 10.0.0.100: ICMP echo request, id 9, seq 0, length 64
00:08:52.772999 IP 10.0.0.100 > 172.17.0.2: ICMP echo reply, id 9, seq 0, length 64

root@ist-PowerEdge-R720:~# tcpdump -i eno2 icmp
00:08:52.772773 IP ist-PowerEdge-R720 > 10.0.0.100: ICMP echo request, id 9, seq 0, length 64
00:08:52.772959 IP 10.0.0.100 > ist-PowerEdge-R720: ICMP echo reply, id 9, seq 0, length 64

```

**Comment by greatsharp** [comment]
交换机Linux Bridge这一节，感觉有几个地方不太理解，

第一步：
源 MAC：veth0 的 MAC
目标 MAC：网关的 MAC（即网桥的 MAC）
源 IP：veth0 的 IP，即 192.168.31.1     -> 应该是192.168.1.10？
目标 IP：外网的 IP，即 122.246.6.183

第五步：
源 MAC：网桥的 MAC
目标 MAC：veth0 的 MAC
源 IP：外网的 IP，即 122.246.6.183
目标 IP：veth0 的 IP，即 192.168.31.1   -> 应该是192.168.1.10？

**Comment by blackstar-baba** [comment]
`而是根据这些底层操作根据其目的`有点绕口，建议修改下。
